{
  "$schema": "../../../schemas/compliance/audit-trail-comparison.schema.json",
  "surface": "17-point",
  "version": "2026-05-21",
  "title": "Herald's 17 — chain-of-custody, point by point, with the spec section that proves each one",
  "external_checklist_name": "Kognitos 12-field audit-trail checklist",
  "external_checklist_source": {
    "label": "AI Audit Trail Requirements: A 2026 Checklist for Finance, Healthcare, and Banking — Kognitos blog",
    "href": "https://www.kognitos.com/blog/ai-audit-trail-requirements-2026-checklist/",
    "published_date": "2026-05-15"
  },
  "spec_reference": {
    "label": "FFIEC chain-of-custody specification",
    "version": "PRD-2 DRAFT-0.2.0"
  },
  "rows": [
    {
      "point_number": 1,
      "title": "Timestamp, with a documented trust posture",
      "is_spearhead": false,
      "kognitos_framing": "Timestamp (NTP-synced, in UTC). Establishes when the decision occurred; NTP synchronization is now expected and system clock drift is no longer acceptable.",
      "herald_framing": "The chain carries three timestamps and tells you which one to trust for what. `ffiec.chain.captured_at` is the SDK's stamp at capture, MAC-bound, at nanosecond precision — that is the integrity-bearing timestamp. `mac_computed_at_utc` is recommended forensic metadata; the verifier must not trust it for security decisions. `received_at` is ledger-stamped at ingest and used as the day-boundary discriminator, never in the SDK canonical bytes. The chain's ordering invariant is `seq` per `run_id`, not wall-clock time, so leap-seconds and NTP step-back surface as PASS-with-anomaly rather than integrity failure. Trusted-time integration via RFC 3161 timestamp tokens is normated; eIDAS Article 41(2) presumptive-legal-effect composition rides alongside.",
      "spec_references": ["§4.2.2", "§4.4", "§10.4", "§10.14"],
      "spec_status": "normative-prd-2",
      "independence_verdict": "clearly-independent"
    },
    {
      "point_number": 2,
      "title": "Unique decision ID, with parent-linkage discipline",
      "is_spearhead": false,
      "kognitos_framing": "Unique decision ID (UUID or equivalent). Allows reconstruction of a specific decision under examination.",
      "herald_framing": "The decision identifier is the triple `(tenant_id, run_id, seq)`. Parent-child agent flows carry `parent_run_id` and `parent_seq`; DAG-shaped multi-agent flows carry `dag_parents`. Cross-vendor handover and entity succession compose under the same parent-linkage primitive. The chain-tail acquisition rule names three places to look, in order: in-memory, local sidecar, ledger query — with a single-writer-per-run rule and an intra-process mutex contract that closes the silent-restart attack class.",
      "spec_references": ["§3", "§4.4", "§10.21", "§10.24", "§10.25"],
      "spec_status": "normative-prd-2",
      "independence_verdict": "convergent-on-prior-art",
      "prior_art_notes": "Unique decision identifiers and composite run-IDs are commodity primitives both parties draw from. Prior art predating both: RFC 4122 (UUID URN namespace, 2005); distributed-run-identifier patterns in Apache Spark, Apache Airflow, Temporal, and Kubernetes. Herald's parent-linkage discipline and the single-writer-per-run silent-restart closure are the substantive engineering composition on top of those primitives."
    },
    {
      "point_number": 3,
      "title": "Authenticated human user identity, on three composable surfaces",
      "is_spearhead": false,
      "kognitos_framing": "Authenticated human user identity (not just service account). HIPAA's unique user identification rule, GDPR's accountability principle, and SOX's individual attribution requirement all demand this.",
      "herald_framing": "Identity composes from three surfaces today. Reviewer identity is captured when a human reviews AI output, cryptographically signed under that reviewer's per-reviewer key. Institutional actors sign operational events under the §10.17 signatory schema. The SDK process authenticates to the IKM custodian via SPIFFE/SPIRE, mTLS, or HSM bearer token — that is workload identity, not human identity. For the SSO-authenticated end-user that HIPAA §164.312(a)(2)(i) anchors, the institution's CC8.1 currently names an enricher attribute under the `audit.*` namespace; coverage is institution-side until a normative `audit.actor.*` family lands. That family is candidate-normative for PRD-3 and closes the dependency with a per-chain-entry actor attribute group.",
      "spec_references": ["§4.1.1", "§10.2", "§10.17", "§10.50", "CC8.1 actor-enricher convention"],
      "spec_status": "mixed-prd-2-and-prd-3",
      "candidate_normative_prd3": ["audit.actor.*"],
      "independence_verdict": "clearly-independent"
    },
    {
      "point_number": 4,
      "title": "AI system identity and version, including multi-LLM routing",
      "is_spearhead": false,
      "kognitos_framing": "AI system identity and version. Identifies the platform that made the decision; required for change management.",
      "herald_framing": "The chain captures routing as its own event family. Multi-LLM deployments emit `audit.routing.*` entries with `parent_run_id` / `parent_seq` links back to the downstream LLM call. Every model invocation carries a deployment-intent enum (`production`, `ab_test`, `canary`, `multi_region_drift`, `vendor_reroute_observed`, `regulatory_sandbox`, `disparate_impact_test_run`) and the `vendor_reroute_detection_policy_hash` is chain-bound on every invocation — not only on detected reroutes. The verifier surfaces routing-pairing violations: a success without a paired attempt, a failover without a causal predecessor.",
      "spec_references": ["§4.4.1", "§4.4.2", "verifier procedure P-33"],
      "spec_status": "normative-prd-2",
      "independence_verdict": "clearly-independent"
    },
    {
      "point_number": 5,
      "title": "Model identity and version, refused at write time when missing",
      "is_spearhead": false,
      "kognitos_framing": "Model identity and version. Specific version pinning is required — \"GPT-4\" is not sufficient.",
      "herald_framing": "Two attributes are both required on any chain entry representing a model call: `gen_ai.request.model` and `gen_ai.response.model`. The SDK refuses to emit a chain entry carrying any `gen_ai.*` attribute that lacks either identifier — refusal at write time, not just defense-in-depth at the verifier. `model_weight_hash` binds reproducibility, institution-supplied for closed-weight vendor models and on-disk for open-weight in-institution models. Model activation requires references to a `model_validation.attestation` event and an `mrm_disposition.recorded` event, under a validation-precedes-activation ordering the verifier enforces.",
      "spec_references": ["§4.4", "§10.33", "§10.48"],
      "spec_status": "normative-prd-2",
      "independence_verdict": "clearly-independent"
    },
    {
      "point_number": 6,
      "title": "Inputs received, with per-document anchoring",
      "is_spearhead": false,
      "kognitos_framing": "Inputs received, with source attribution. Auditors must be able to verify what data the AI acted on and where it came from.",
      "herald_framing": "Two layers bind under the per-event MAC. The generation event carries a four-tuple — system prompt SHA-256, user prompt SHA-256, retrieval-set Merkle root SHA-256, output SHA-256. Each retrieved document then emits as its own chain entry with `audit.retrieval.document_anchor.*` attributes, and `canonical_identifier_kind` covers PMID, DOI, ISBN, FDA-label, and institutional document IDs. The verifier cross-binds the two layers: every per-document anchor's `document_sha256` must appear in the retrieval-set Merkle root, and the leaf count matches the per-document anchor count. The Merkle ordering is lexicographic by `document_sha256`, not by relevance score, so byte-identicality holds across implementations.",
      "spec_references": ["§10.47", "§10.49"],
      "spec_status": "normative-prd-2",
      "independence_verdict": "clearly-independent"
    },
    {
      "point_number": 7,
      "title": "Specific policy, rule, or prompt, hash-bound under per-event MAC",
      "is_spearhead": false,
      "kognitos_framing": "Specific policy, rule, or prompt invoked. Must be inspectable and version-controlled — for LLM-based decisions, the system prompt and user prompt verbatim; for rule-based decisions, the rule expression.",
      "herald_framing": "The chain binds the hash of every policy, prompt, and rule under the per-event MAC. Five surfaces compose under the same pattern: the generation event's system prompt hash, the routing event's policy version, the deployment event's policy version, the redaction event's policy_id and version, and the EU AI Act Article 86 `explanation_text_hash`. The institution-side prompt registry resolves the hash and version to plaintext per CC8.1. Cross-vendor handover captures the provider-side policy artifacts. The institution operates the registry; the chain integrity-binds the hash.",
      "spec_references": ["§4.4.1", "§4.4.2", "§10.22", "§10.47", "§10.74", "institution-side prompt registry per CC8.1"],
      "spec_status": "normative-prd-2",
      "independence_verdict": "clearly-independent"
    },
    {
      "point_number": 8,
      "title": "Reasoning expressed in human-readable language, separated from the chain's integrity layer",
      "is_spearhead": false,
      "kognitos_framing": "Reasoning in human-readable language. The EU AI Act's right-to-explanation, GDPR Article 22, and ECOA's specific principal reasons all require human-readable reasoning rather than confidence scores.",